{
  "fidelity": {
    "condition": {
      "reason": null,
      "state": "match"
    },
    "date": {
      "reason": null,
      "state": "match"
    },
    "extractor_version": "fidelity-extractor-v1+Berlin-2026-07-15",
    "hourly": {
      "coverage": null,
      "points": [
        {
          "hour": 0,
          "state": "not-shown"
        },
        {
          "hour": 1,
          "state": "not-shown"
        },
        {
          "hour": 2,
          "state": "not-shown"
        },
        {
          "hour": 3,
          "state": "not-shown"
        },
        {
          "hour": 4,
          "state": "not-shown"
        },
        {
          "hour": 5,
          "state": "not-shown"
        },
        {
          "hour": 6,
          "state": "not-shown"
        },
        {
          "hour": 7,
          "state": "not-shown"
        },
        {
          "hour": 8,
          "state": "not-shown"
        },
        {
          "hour": 9,
          "state": "not-shown"
        },
        {
          "hour": 10,
          "state": "not-shown"
        },
        {
          "hour": 11,
          "state": "not-shown"
        },
        {
          "hour": 12,
          "state": "not-shown"
        },
        {
          "hour": 13,
          "state": "not-shown"
        },
        {
          "hour": 14,
          "state": "not-shown"
        },
        {
          "hour": 15,
          "state": "not-shown"
        },
        {
          "hour": 16,
          "state": "not-shown"
        },
        {
          "hour": 17,
          "state": "not-shown"
        },
        {
          "hour": 18,
          "state": "not-shown"
        },
        {
          "hour": 19,
          "state": "not-shown"
        },
        {
          "hour": 20,
          "state": "not-shown"
        },
        {
          "hour": 21,
          "state": "not-shown"
        },
        {
          "hour": 22,
          "state": "not-shown"
        },
        {
          "hour": 23,
          "state": "not-shown"
        }
      ],
      "points_match": 0,
      "points_mismatch": 0,
      "points_not_shown": 24,
      "reason": "no-hourly-candidate",
      "state": "not-found"
    },
    "max": {
      "display_decimals": 0,
      "reason": null,
      "state": "match",
      "value": "25"
    },
    "min": {
      "display_decimals": 0,
      "reason": null,
      "state": "match",
      "value": "16"
    },
    "name": {
      "reason": null,
      "state": "match"
    },
    "request_side": {
      "status": "match",
      "violations": []
    }
  },
  "flags": [],
  "l1": {
    "bytes": {
      "css": 9869,
      "html": 2247,
      "js": 8604,
      "total": 20720
    },
    "palette_top8": [
      {
        "bin_index": 122,
        "lab": {
          "L": 87.5,
          "a": -18.333333333333343,
          "b": -18.333333333333343
        },
        "weight": 0.46513671875
      },
      {
        "bin_index": 14,
        "lab": {
          "L": 12.5,
          "a": -18.333333333333343,
          "b": -18.333333333333343
        },
        "weight": 0.1439453125
      },
      {
        "bin_index": 50,
        "lab": {
          "L": 37.5,
          "a": -18.333333333333343,
          "b": -18.333333333333343
        },
        "weight": 0.1408203125
      },
      {
        "bin_index": 20,
        "lab": {
          "L": 12.5,
          "a": 18.333333333333314,
          "b": -18.333333333333343
        },
        "weight": 0.0681640625
      },
      {
        "bin_index": 55,
        "lab": {
          "L": 37.5,
          "a": 18.333333333333314,
          "b": -55.0
        },
        "weight": 0.0544921875
      },
      {
        "bin_index": 123,
        "lab": {
          "L": 87.5,
          "a": -18.333333333333343,
          "b": 18.333333333333314
        },
        "weight": 0.04453125
      },
      {
        "bin_index": 86,
        "lab": {
          "L": 62.5,
          "a": -18.333333333333343,
          "b": -18.333333333333343
        },
        "weight": 0.03427734375
      },
      {
        "bin_index": 49,
        "lab": {
          "L": 37.5,
          "a": -18.333333333333343,
          "b": -55.0
        },
        "weight": 0.0306640625
      }
    ],
    "structure": {
      "css_rules": 63,
      "dom_depth": 9,
      "dom_nodes": 47,
      "js_bytes_present": true
    },
    "visual": {
      "brightness": 156.54700029296876,
      "colorfulness": 57.62026152319447,
      "contrast": 87.53944821587658,
      "frame_change": {
        "max": 0.0,
        "median": 0.0
      },
      "whitespace_ratio": 0.5142578125
    }
  },
  "slot_index": 1,
  "state": "valid",
  "telemetry": {
    "completion_tokens": 12995,
    "cost_usd": null,
    "prompt_tokens": null,
    "request_id": null,
    "total_tokens": null,
    "wall_ms": 130573
  }
}
