{
  "fidelity": {
    "condition": {
      "reason": null,
      "state": "match"
    },
    "date": {
      "reason": null,
      "state": "match"
    },
    "extractor_version": "fidelity-extractor-v1+Berlin-2026-07-15",
    "hourly": {
      "coverage": "24/24",
      "points": [
        {
          "hour": 0,
          "state": "match"
        },
        {
          "hour": 1,
          "state": "match"
        },
        {
          "hour": 2,
          "state": "match"
        },
        {
          "hour": 3,
          "state": "match"
        },
        {
          "hour": 4,
          "state": "match"
        },
        {
          "hour": 5,
          "state": "match"
        },
        {
          "hour": 6,
          "state": "match"
        },
        {
          "hour": 7,
          "state": "match"
        },
        {
          "hour": 8,
          "state": "match"
        },
        {
          "hour": 9,
          "state": "match"
        },
        {
          "hour": 10,
          "state": "match"
        },
        {
          "hour": 11,
          "state": "match"
        },
        {
          "hour": 12,
          "state": "match"
        },
        {
          "hour": 13,
          "state": "match"
        },
        {
          "hour": 14,
          "state": "match"
        },
        {
          "hour": 15,
          "state": "match"
        },
        {
          "hour": 16,
          "state": "match"
        },
        {
          "hour": 17,
          "state": "match"
        },
        {
          "hour": 18,
          "state": "match"
        },
        {
          "hour": 19,
          "state": "match"
        },
        {
          "hour": 20,
          "state": "match"
        },
        {
          "hour": 21,
          "state": "match"
        },
        {
          "hour": 22,
          "state": "match"
        },
        {
          "hour": 23,
          "state": "match"
        }
      ],
      "points_match": 24,
      "points_mismatch": 0,
      "points_not_shown": 0,
      "reason": null,
      "state": "match"
    },
    "max": {
      "display_decimals": 0,
      "reason": null,
      "state": "match",
      "value": "25"
    },
    "min": {
      "display_decimals": 0,
      "reason": null,
      "state": "match",
      "value": "16"
    },
    "name": {
      "reason": null,
      "state": "match"
    },
    "request_side": {
      "status": "match",
      "violations": []
    }
  },
  "flags": [],
  "l1": {
    "bytes": {
      "css": 2500,
      "html": 911,
      "js": 4308,
      "total": 7719
    },
    "palette_top8": [
      {
        "bin_index": 122,
        "lab": {
          "L": 87.5,
          "a": -18.333333333333343,
          "b": -18.333333333333343
        },
        "weight": 0.78447265625
      },
      {
        "bin_index": 85,
        "lab": {
          "L": 62.5,
          "a": -18.333333333333343,
          "b": -55.0
        },
        "weight": 0.08349609375
      },
      {
        "bin_index": 91,
        "lab": {
          "L": 62.5,
          "a": 18.333333333333314,
          "b": -55.0
        },
        "weight": 0.04111328125
      },
      {
        "bin_index": 86,
        "lab": {
          "L": 62.5,
          "a": -18.333333333333343,
          "b": -18.333333333333343
        },
        "weight": 0.041015625
      },
      {
        "bin_index": 123,
        "lab": {
          "L": 87.5,
          "a": -18.333333333333343,
          "b": 18.333333333333314
        },
        "weight": 0.02578125
      },
      {
        "bin_index": 121,
        "lab": {
          "L": 87.5,
          "a": -18.333333333333343,
          "b": -55.0
        },
        "weight": 0.0173828125
      },
      {
        "bin_index": 50,
        "lab": {
          "L": 37.5,
          "a": -18.333333333333343,
          "b": -18.333333333333343
        },
        "weight": 0.0029296875
      },
      {
        "bin_index": 128,
        "lab": {
          "L": 87.5,
          "a": 18.333333333333314,
          "b": -18.333333333333343
        },
        "weight": 0.0021484375
      }
    ],
    "structure": {
      "css_rules": 19,
      "dom_depth": 7,
      "dom_nodes": 23,
      "js_bytes_present": true
    },
    "visual": {
      "brightness": 213.9084697265625,
      "colorfulness": 79.53287546234941,
      "contrast": 35.78195886916357,
      "frame_change": {
        "max": 0.0,
        "median": 0.0
      },
      "whitespace_ratio": 0.464453125
    }
  },
  "slot_index": 3,
  "state": "valid",
  "telemetry": {
    "completion_tokens": 2714,
    "cost_usd": null,
    "prompt_tokens": 339,
    "request_id": null,
    "total_tokens": 3053,
    "wall_ms": 63593
  }
}
