{
  "fidelity": {
    "condition": {
      "reason": null,
      "state": "match"
    },
    "date": {
      "reason": null,
      "state": "match"
    },
    "extractor_version": "fidelity-extractor-v1+Berlin-2026-07-15",
    "hourly": {
      "coverage": null,
      "points": [
        {
          "hour": 0,
          "state": "not-shown"
        },
        {
          "hour": 1,
          "state": "not-shown"
        },
        {
          "hour": 2,
          "state": "not-shown"
        },
        {
          "hour": 3,
          "state": "not-shown"
        },
        {
          "hour": 4,
          "state": "not-shown"
        },
        {
          "hour": 5,
          "state": "not-shown"
        },
        {
          "hour": 6,
          "state": "not-shown"
        },
        {
          "hour": 7,
          "state": "not-shown"
        },
        {
          "hour": 8,
          "state": "not-shown"
        },
        {
          "hour": 9,
          "state": "not-shown"
        },
        {
          "hour": 10,
          "state": "not-shown"
        },
        {
          "hour": 11,
          "state": "not-shown"
        },
        {
          "hour": 12,
          "state": "not-shown"
        },
        {
          "hour": 13,
          "state": "not-shown"
        },
        {
          "hour": 14,
          "state": "not-shown"
        },
        {
          "hour": 15,
          "state": "not-shown"
        },
        {
          "hour": 16,
          "state": "not-shown"
        },
        {
          "hour": 17,
          "state": "not-shown"
        },
        {
          "hour": 18,
          "state": "not-shown"
        },
        {
          "hour": 19,
          "state": "not-shown"
        },
        {
          "hour": 20,
          "state": "not-shown"
        },
        {
          "hour": 21,
          "state": "not-shown"
        },
        {
          "hour": 22,
          "state": "not-shown"
        },
        {
          "hour": 23,
          "state": "not-shown"
        }
      ],
      "points_match": 0,
      "points_mismatch": 0,
      "points_not_shown": 24,
      "reason": "daily-canonical-incomplete",
      "state": "ambiguous"
    },
    "max": {
      "display_decimals": null,
      "reason": "no-remaining-candidate",
      "state": "ambiguous",
      "value": null
    },
    "min": {
      "display_decimals": 0,
      "reason": null,
      "state": "mismatch",
      "value": "25"
    },
    "name": {
      "reason": null,
      "state": "match"
    },
    "request_side": {
      "status": "match",
      "violations": []
    }
  },
  "flags": [],
  "l1": {
    "bytes": {
      "css": 5049,
      "html": 2306,
      "js": 9368,
      "total": 16723
    },
    "palette_top8": [
      {
        "bin_index": 20,
        "lab": {
          "L": 12.5,
          "a": 18.333333333333314,
          "b": -18.333333333333343
        },
        "weight": 0.72529296875
      },
      {
        "bin_index": 14,
        "lab": {
          "L": 12.5,
          "a": -18.333333333333343,
          "b": -18.333333333333343
        },
        "weight": 0.10908203125
      },
      {
        "bin_index": 50,
        "lab": {
          "L": 37.5,
          "a": -18.333333333333343,
          "b": -18.333333333333343
        },
        "weight": 0.07626953125
      },
      {
        "bin_index": 25,
        "lab": {
          "L": 12.5,
          "a": 55.0,
          "b": -55.0
        },
        "weight": 0.0322265625
      },
      {
        "bin_index": 19,
        "lab": {
          "L": 12.5,
          "a": 18.333333333333314,
          "b": -55.0
        },
        "weight": 0.0212890625
      },
      {
        "bin_index": 56,
        "lab": {
          "L": 37.5,
          "a": 18.333333333333314,
          "b": -18.333333333333343
        },
        "weight": 0.016015625
      },
      {
        "bin_index": 92,
        "lab": {
          "L": 62.5,
          "a": 18.333333333333314,
          "b": -18.333333333333343
        },
        "weight": 0.00654296875
      },
      {
        "bin_index": 128,
        "lab": {
          "L": 87.5,
          "a": 18.333333333333314,
          "b": -18.333333333333343
        },
        "weight": 0.005078125
      }
    ],
    "structure": {
      "css_rules": 30,
      "dom_depth": 6,
      "dom_nodes": 44,
      "js_bytes_present": true
    },
    "visual": {
      "brightness": 33.82003037109375,
      "colorfulness": 36.35390355668605,
      "contrast": 25.541434445640913,
      "frame_change": {
        "max": 0.0,
        "median": 0.0
      },
      "whitespace_ratio": 0.7658203125
    }
  },
  "slot_index": 1,
  "state": "valid",
  "telemetry": {
    "completion_tokens": 5904,
    "cost_usd": null,
    "prompt_tokens": 348,
    "request_id": null,
    "total_tokens": 6252,
    "wall_ms": 98154
  }
}
