{
  "fidelity": {
    "condition": {
      "reason": null,
      "state": "match"
    },
    "date": {
      "reason": null,
      "state": "match"
    },
    "extractor_version": "fidelity-extractor-v1+Berlin-2026-07-15",
    "hourly": {
      "coverage": null,
      "points": [
        {
          "hour": 0,
          "state": "not-shown"
        },
        {
          "hour": 1,
          "state": "not-shown"
        },
        {
          "hour": 2,
          "state": "not-shown"
        },
        {
          "hour": 3,
          "state": "not-shown"
        },
        {
          "hour": 4,
          "state": "not-shown"
        },
        {
          "hour": 5,
          "state": "not-shown"
        },
        {
          "hour": 6,
          "state": "not-shown"
        },
        {
          "hour": 7,
          "state": "not-shown"
        },
        {
          "hour": 8,
          "state": "not-shown"
        },
        {
          "hour": 9,
          "state": "not-shown"
        },
        {
          "hour": 10,
          "state": "not-shown"
        },
        {
          "hour": 11,
          "state": "not-shown"
        },
        {
          "hour": 12,
          "state": "not-shown"
        },
        {
          "hour": 13,
          "state": "not-shown"
        },
        {
          "hour": 14,
          "state": "not-shown"
        },
        {
          "hour": 15,
          "state": "not-shown"
        },
        {
          "hour": 16,
          "state": "not-shown"
        },
        {
          "hour": 17,
          "state": "not-shown"
        },
        {
          "hour": 18,
          "state": "not-shown"
        },
        {
          "hour": 19,
          "state": "not-shown"
        },
        {
          "hour": 20,
          "state": "not-shown"
        },
        {
          "hour": 21,
          "state": "not-shown"
        },
        {
          "hour": 22,
          "state": "not-shown"
        },
        {
          "hour": 23,
          "state": "not-shown"
        }
      ],
      "points_match": 0,
      "points_mismatch": 0,
      "points_not_shown": 24,
      "reason": "daily-canonical-incomplete",
      "state": "ambiguous"
    },
    "max": {
      "display_decimals": 0,
      "reason": "max-equals-min",
      "state": "ambiguous",
      "value": "17"
    },
    "min": {
      "display_decimals": 0,
      "reason": "max-equals-min",
      "state": "ambiguous",
      "value": "17"
    },
    "name": {
      "reason": null,
      "state": "match"
    },
    "request_side": {
      "status": "match",
      "violations": []
    }
  },
  "flags": [],
  "l1": {
    "bytes": {
      "css": 2240,
      "html": 320,
      "js": 5019,
      "total": 7579
    },
    "palette_top8": [
      {
        "bin_index": 55,
        "lab": {
          "L": 37.5,
          "a": 18.333333333333314,
          "b": -55.0
        },
        "weight": 0.55615234375
      },
      {
        "bin_index": 56,
        "lab": {
          "L": 37.5,
          "a": 18.333333333333314,
          "b": -18.333333333333343
        },
        "weight": 0.25390625
      },
      {
        "bin_index": 91,
        "lab": {
          "L": 62.5,
          "a": 18.333333333333314,
          "b": -55.0
        },
        "weight": 0.11162109375
      },
      {
        "bin_index": 92,
        "lab": {
          "L": 62.5,
          "a": 18.333333333333314,
          "b": -18.333333333333343
        },
        "weight": 0.06591796875
      },
      {
        "bin_index": 86,
        "lab": {
          "L": 62.5,
          "a": -18.333333333333343,
          "b": -18.333333333333343
        },
        "weight": 0.01064453125
      },
      {
        "bin_index": 128,
        "lab": {
          "L": 87.5,
          "a": 18.333333333333314,
          "b": -18.333333333333343
        },
        "weight": 0.00087890625
      },
      {
        "bin_index": 122,
        "lab": {
          "L": 87.5,
          "a": -18.333333333333343,
          "b": -18.333333333333343
        },
        "weight": 0.00048828125
      },
      {
        "bin_index": 87,
        "lab": {
          "L": 62.5,
          "a": -18.333333333333343,
          "b": 18.333333333333314
        },
        "weight": 0.0001953125
      }
    ],
    "structure": {
      "css_rules": 22,
      "dom_depth": 4,
      "dom_nodes": 10,
      "js_bytes_present": true
    },
    "visual": {
      "brightness": 94.98196240234374,
      "colorfulness": 42.43868025712189,
      "contrast": 23.30166943186615,
      "frame_change": {
        "max": 0.0,
        "median": 0.0
      },
      "whitespace_ratio": 0.43134765625
    }
  },
  "slot_index": 1,
  "state": "valid",
  "telemetry": {
    "completion_tokens": null,
    "cost_usd": null,
    "prompt_tokens": null,
    "request_id": null,
    "total_tokens": null,
    "wall_ms": 73497
  }
}
