{
  "fidelity": {
    "condition": {
      "reason": null,
      "state": "match"
    },
    "date": {
      "reason": "multi-candidate-conflict",
      "state": "ambiguous"
    },
    "extractor_version": "fidelity-extractor-v1+Berlin-2026-07-15",
    "hourly": {
      "coverage": null,
      "points": [
        {
          "hour": 0,
          "state": "not-shown"
        },
        {
          "hour": 1,
          "state": "not-shown"
        },
        {
          "hour": 2,
          "state": "not-shown"
        },
        {
          "hour": 3,
          "state": "not-shown"
        },
        {
          "hour": 4,
          "state": "not-shown"
        },
        {
          "hour": 5,
          "state": "not-shown"
        },
        {
          "hour": 6,
          "state": "not-shown"
        },
        {
          "hour": 7,
          "state": "not-shown"
        },
        {
          "hour": 8,
          "state": "not-shown"
        },
        {
          "hour": 9,
          "state": "not-shown"
        },
        {
          "hour": 10,
          "state": "not-shown"
        },
        {
          "hour": 11,
          "state": "not-shown"
        },
        {
          "hour": 12,
          "state": "not-shown"
        },
        {
          "hour": 13,
          "state": "not-shown"
        },
        {
          "hour": 14,
          "state": "not-shown"
        },
        {
          "hour": 15,
          "state": "not-shown"
        },
        {
          "hour": 16,
          "state": "not-shown"
        },
        {
          "hour": 17,
          "state": "not-shown"
        },
        {
          "hour": 18,
          "state": "not-shown"
        },
        {
          "hour": 19,
          "state": "not-shown"
        },
        {
          "hour": 20,
          "state": "not-shown"
        },
        {
          "hour": 21,
          "state": "not-shown"
        },
        {
          "hour": 22,
          "state": "not-shown"
        },
        {
          "hour": 23,
          "state": "not-shown"
        }
      ],
      "points_match": 0,
      "points_mismatch": 0,
      "points_not_shown": 24,
      "reason": "repeated-hour-different-value",
      "state": "ambiguous"
    },
    "max": {
      "display_decimals": 1,
      "reason": null,
      "state": "match",
      "value": "25.3"
    },
    "min": {
      "display_decimals": 0,
      "reason": null,
      "state": "mismatch",
      "value": "17"
    },
    "name": {
      "reason": null,
      "state": "match"
    },
    "request_side": {
      "status": "match",
      "violations": []
    }
  },
  "flags": [
    "unstable-after-freeze",
    "non-deterministic-render"
  ],
  "l1": {
    "bytes": {
      "css": 9221,
      "html": 408,
      "js": 18864,
      "total": 28493
    },
    "palette_top8": [
      {
        "bin_index": 21,
        "lab": {
          "L": 12.5,
          "a": 18.333333333333314,
          "b": 18.333333333333314
        },
        "weight": 0.97255859375
      },
      {
        "bin_index": 57,
        "lab": {
          "L": 37.5,
          "a": 18.333333333333314,
          "b": 18.333333333333314
        },
        "weight": 0.0115234375
      },
      {
        "bin_index": 15,
        "lab": {
          "L": 12.5,
          "a": -18.333333333333343,
          "b": 18.333333333333314
        },
        "weight": 0.0060546875
      },
      {
        "bin_index": 93,
        "lab": {
          "L": 62.5,
          "a": 18.333333333333314,
          "b": 18.333333333333314
        },
        "weight": 0.00234375
      },
      {
        "bin_index": 129,
        "lab": {
          "L": 87.5,
          "a": 18.333333333333314,
          "b": 18.333333333333314
        },
        "weight": 0.0015625
      },
      {
        "bin_index": 123,
        "lab": {
          "L": 87.5,
          "a": -18.333333333333343,
          "b": 18.333333333333314
        },
        "weight": 0.00126953125
      },
      {
        "bin_index": 14,
        "lab": {
          "L": 12.5,
          "a": -18.333333333333343,
          "b": -18.333333333333343
        },
        "weight": 0.001171875
      },
      {
        "bin_index": 51,
        "lab": {
          "L": 37.5,
          "a": -18.333333333333343,
          "b": 18.333333333333314
        },
        "weight": 0.0009765625
      }
    ],
    "structure": {
      "css_rules": 79,
      "dom_depth": 6,
      "dom_nodes": 12,
      "js_bytes_present": true
    },
    "visual": {
      "brightness": 15.9347873046875,
      "colorfulness": 15.800344066989869,
      "contrast": 19.382404601861673,
      "frame_change": {
        "max": 0.29948828125,
        "median": 0.107138671875
      },
      "whitespace_ratio": 0.9521484375
    }
  },
  "slot_index": 3,
  "state": "valid",
  "telemetry": {
    "completion_tokens": 39174,
    "cost_usd": null,
    "prompt_tokens": 311,
    "request_id": null,
    "total_tokens": 39485,
    "wall_ms": 500334
  }
}
